nombre, descripcion, fecha
Pitagoras, Pitagoras inventa el teorema de pitagoras, 100 Antes de Cristo
Carl Friedrich Gauss, uno de los matemáticos más importantes de la historia, nació el 30 de abril de 1777
Leonardo Filius Bonacci(Fibonacci), creador de una de las sucesiónes más importantes la sucesión de fibonacci, 1170 - 1250
Dia de Pi, en este día se celebra el número pi, 14 de marzo
Fibot, Soy el actual chatbot que esta usando creado el programa delfín, 17 de julio de 2020
Fucionalidad de Fibot, Sirvo para resolver diversas, fui creado el 16 de julio de 2020 
Creadores de Fibot, Angel Benjamin Victor e Ivan Vladimir son los creadores de Fibot, 17 de julio de 2020